nct_id,last_update_submitted_date,registration_date,summary_results_date,study_type,phase,enrollment,recruitment_status,title,start_date,completion_date,primary_completion_date,has_summary_results,allocation,masking,main_sponsor,is_multicentric,ucdavis_principal_investigator,ucdavis_study_chair,ucdavis_study_director,ucdavis_unspecified_official,registration_year,start_year,completion_year,primary_completion_year
NCT01186393,2015-05-14,2010-08-19,NA,Interventional,Not Applicable,90,Completed,STUDY: Effects of Potatoes in a Weight Loss Program,2007-05-01T00:00:00Z,2014-03-01T00:00:00Z,2010-11-01T00:00:00Z,FALSE,Randomized,Single,OTHER,TRUE,"University of California, Davis",NA,NA,NA,2010,2007,2014,2010
NCT01330641,2011-04-06,2011-04-05,NA,Interventional,Not Applicable,75,Completed,Accuracy of Needle Placement Into The Subacromial Space of The Shoulder,2008-09-01T00:00:00Z,2011-03-01T00:00:00Z,2010-05-01T00:00:00Z,FALSE,Randomized,Single,OTHER,FALSE,"University of California, Davis",NA,NA,NA,2011,2008,2011,2010
NCT01483508,2012-10-23,2011-11-28,NA,Interventional,Not Applicable,12,Completed,Absorption and Metabolism of Dietary Cocoa Procyanidins in Humans,2008-02-01T00:00:00Z,2008-08-01T00:00:00Z,2008-08-01T00:00:00Z,FALSE,Randomized,Double,OTHER,FALSE,"Department of Nutrition, University of California Davis","Department of Nutition, University of California Davis",NA,NA,2011,2008,2008,2008
NCT01587911,2017-08-10,2012-04-26,NA,Interventional,Not Applicable,20,Completed,Casinomacropeptide and Satiety,2008-05-01T00:00:00Z,2015-09-01T00:00:00Z,2009-05-01T00:00:00Z,FALSE,Randomized,Single,OTHER,FALSE,"University of California, Davis",NA,NA,NA,2012,2008,2015,2009
NCT01838239,2017-05-25,2013-04-18,NA,Interventional,Not Applicable,12,Completed,Development of a Metabolic Assessment Tool for Chronic Kidney Disease,2008-06-01T00:00:00Z,2011-06-01T00:00:00Z,2010-06-01T00:00:00Z,FALSE,NA,None (Open Label),OTHER,FALSE,"University of California, Davis",NA,NA,NA,2013,2008,2011,2010
