nct_id,last_update_submitted_date,registration_date,summary_results_date,study_type,phase,enrollment,recruitment_status,title,start_date,completion_date,primary_completion_date,has_summary_results,allocation,masking,main_sponsor,is_multicentric,ucsd_lead_sponsor,ucsd_principal_investigator,ucsd_study_chair,ucsd_study_director,ucsd_unspecified_official,ucsd_responsible_party,registration_year,start_year,completion_year
NCT00997867,2010-10-27,2009-10-18,NA,Interventional,Phase 4,350,Completed,Perineural Catheter Insertion Distance for Continuous Peripheral Nerve Blocks,2009-11-01T00:00:00Z,2010-10-01T00:00:00Z,2010-10-01T00:00:00Z,FALSE,Randomized,Single,OTHER,FALSE,"University of California, San Diego","University of California, San Diego",NA,NA,NA,"University of California, San Diego, Department of Anesthesiology",2009,2009,2010
NCT01004341,2013-06-18,2009-10-20,NA,Interventional,Not Applicable,44,Completed,Role of Parenting Skills and Parenting Style in Pediatric Weight Loss Programs,2009-06-01T00:00:00Z,2012-05-01T00:00:00Z,2012-05-01T00:00:00Z,FALSE,NA,None (Open Label),OTHER,FALSE,"University of California, San Diego","University of California, San Diego",NA,NA,NA,"University of California, San Diego",2009,2009,2012
NCT01008722,2016-12-12,2009-11-05,2016-12-12,Observational,NA,98,Completed,The Dynamics of Human Atrial Fibrillation,2009-06-01T00:00:00Z,2014-05-01T00:00:00Z,2014-04-01T00:00:00Z,TRUE,NA,NA,OTHER,TRUE,"University of California, San Diego","University of California, San Diego",NA,NA,NA,"University of California, San Diego",2009,2009,2014
NCT01009112,2015-05-26,2009-11-05,NA,Interventional,Not Applicable,45,Completed,Treating Insomnia & Nightmares After Trauma: Impact on Symptoms & Quality of Life,2010-01-01T00:00:00Z,2012-11-01T00:00:00Z,2012-08-01T00:00:00Z,FALSE,Randomized,Single,OTHER,FALSE,"University of California, San Diego",Veterans Medical Research Foundation & University of California San Diego,NA,NA,NA,"University of California, San Diego",2009,2010,2012
NCT01011348,2020-02-05,2009-11-10,NA,Interventional,Not Applicable,58,Completed,Q10 for Gulf War Veterans,2008-07-01T00:00:00Z,2011-07-01T00:00:00Z,2011-07-01T00:00:00Z,FALSE,Randomized,Triple,OTHER,FALSE,"University of California, San Diego","University of California, San Diego",NA,NA,NA,NA,2009,2008,2011
NCT01020513,2013-12-10,2009-11-24,NA,Observational,NA,0,Withdrawn,Subcutaneous Recombinant Human Hyaluronidase: Workflow Analysis and Emergency Department Design,2010-11-01T00:00:00Z,2011-02-01T00:00:00Z,2011-01-01T00:00:00Z,FALSE,NA,NA,OTHER,TRUE,"University of California, San Diego","UCSD School of Medicine, Department of General Internal Medicine",NA,NA,NA,"University of California, San Diego",2009,2010,2011
NCT01027936,2010-11-08,2009-12-08,NA,Observational,NA,180,Unknown status,"An Age-Stratified Data Collection Study in Adult Males and Females, Ages 18 and Above to Establish a Normative Database Using the 3D Optical Coherence Tomography 3D OCT-1000 Mark II",2009-04-01T00:00:00Z,2010-11-01T00:00:00Z,2010-03-01T00:00:00Z,FALSE,NA,NA,INDUSTRY,TRUE,NA,NA,NA,"University of California, San Diego; Shiley Eye Center",NA,NA,2009,2009,2010
NCT01035697,2019-03-20,2009-12-17,NA,Observational,NA,1067,Completed,Inflammatory Cytokines Associated With Perinatal Brain Injury,1999-07-01T00:00:00Z,2004-05-01T00:00:00Z,2002-07-01T00:00:00Z,FALSE,NA,NA,NETWORK,TRUE,NA,"University of California, San Diego",NA,NA,NA,NA,2009,1999,2004
NCT01058694,2010-01-28,2010-01-27,NA,Interventional,Not Applicable,720,Completed,The Impact of Short Message Services (SMS) on ARV Adherence in Western Kenya,2007-06-01T00:00:00Z,2009-07-01T00:00:00Z,2008-12-01T00:00:00Z,FALSE,Randomized,None (Open Label),OTHER,FALSE,NA,"University of California, San Diego",NA,NA,NA,NA,2010,2007,2009
NCT01059006,2011-08-04,2010-01-28,NA,Interventional,Not Applicable,0,Withdrawn,Peripheral PresbyLASIK Using the Allegretto Wavelight System For The Treatment of Presbyopia,2010-01-01T00:00:00Z,2010-07-01T00:00:00Z,2010-07-01T00:00:00Z,FALSE,NA,None (Open Label),OTHER,TRUE,"University of California, San Diego",UCSD Shiley Eye Center,NA,NA,NA,UCSD Shiley Eye Center,2010,2010,2010
NCT01059019,2013-06-19,2010-01-28,NA,Interventional,Not Applicable,17,Completed,Epithelial Healing and Visual Outcomes Using Omega-3 Therapy Before and After Photorefractive Keratectomy (PRK) Surgery,2010-01-01T00:00:00Z,2011-05-01T00:00:00Z,2011-05-01T00:00:00Z,FALSE,Randomized,Single,OTHER,FALSE,"University of California, San Diego",UCSD Shiley Eye Center,NA,NA,NA,"University of California, San Diego",2010,2010,2011
NCT01062568,2019-08-08,2010-02-03,2019-06-10,Interventional,Phase 3,50,Completed,The Adrenal Contribution to Androgen Production in Girls During Puberty,2010-02-01T00:00:00Z,2014-07-01T00:00:00Z,2014-07-01T00:00:00Z,TRUE,Non-Randomized,None (Open Label),OTHER,FALSE,"University of California, San Diego",UCSD,NA,NA,NA,"University of California, San Diego",2010,2010,2014
NCT01065558,2013-04-17,2010-02-06,2012-12-18,Interventional,Phase 1,5,Completed,Safety and Tolerability of the D1 Dopamine Receptor Antagonist Ecopipam in Patients With Lesch-Nyhan Disease,2010-02-01T00:00:00Z,2011-06-01T00:00:00Z,2011-01-01T00:00:00Z,TRUE,NA,None (Open Label),INDUSTRY,TRUE,NA,"University of California, San Diego",NA,NA,NA,NA,2010,2010,2011
NCT01066364,2020-07-01,2010-02-08,2020-07-01,Interventional,Phase 2,59,Completed,Colesevelam Versus Placebo in the Treatment of Nonalcoholic Steatohepatitis,2010-02-01T00:00:00Z,2012-02-01T00:00:00Z,2012-02-01T00:00:00Z,TRUE,Randomized,Quadruple,OTHER,TRUE,"University of California, San Diego","University of California, San Diego",NA,NA,NA,"University of California, San Diego",2010,2010,2012
NCT01078636,2014-09-15,2010-03-01,NA,Observational,NA,342,Completed,Alzheimer's Disease Neuroimaging Initiative Grand Opportunity,2010-04-01T00:00:00Z,2012-10-01T00:00:00Z,2012-10-01T00:00:00Z,FALSE,NA,NA,OTHER,TRUE,NA,NA,"University of California, San Diego",NA,NA,NA,2010,2010,2012
NCT01081249,2014-10-13,2010-03-03,2014-09-16,Interventional,Phase 4,18,Completed,Effects of Oxytocin on Behavior and Physiology in a Psychotherapy Setting,2008-12-01T00:00:00Z,2012-07-01T00:00:00Z,2012-07-01T00:00:00Z,TRUE,Randomized,Triple,INDIV,FALSE,NA,UCSD,NA,NA,NA,NA,2010,2008,2012
NCT01086059,2021-04-01,2010-03-11,NA,Observational,NA,944,Completed,OTIS Autoimmune Diseases in Pregnancy Project,2003-11-01T00:00:00Z,2019-10-01T00:00:00Z,2016-08-01T00:00:00Z,FALSE,NA,NA,OTHER,FALSE,"University of California, San Diego","University of California, San Diego",NA,NA,NA,"University of California, San Diego",2010,2003,2019
NCT01098422,2021-08-02,2010-04-01,2020-05-06,Interventional,Not Applicable,10,Terminated,A Study of Yttrium-90 Radioactive Resin Microspheres to Treat Colorectal Adenocarcinoma Metastatic to the Liver,2010-01-01T00:00:00Z,2015-02-01T00:00:00Z,2015-02-01T00:00:00Z,TRUE,NA,None (Open Label),OTHER,TRUE,NA,"University of California, San Diego",NA,NA,NA,"University of California, San Diego",2010,2010,2015
NCT01112839,2015-06-17,2010-04-26,NA,Interventional,Not Applicable,692,Completed,Reducing Breast Cancer Recurrence With Weight Loss,2010-05-01T00:00:00Z,2015-02-01T00:00:00Z,2015-02-01T00:00:00Z,FALSE,Randomized,None (Open Label),OTHER,TRUE,"University of California, San Diego","University of California, San Diego",NA,NA,NA,"University of California, San Diego",2010,2010,2015
NCT01114958,2020-02-06,2010-04-28,NA,Interventional,Phase 1,8,Completed,Pilot Study of Intra-Arterial Cisplatin With IV Thiosulfate in Patients With Lung Cancer or Lung Metastases,2009-09-03T00:00:00Z,2013-05-17T00:00:00Z,2013-05-17T00:00:00Z,FALSE,NA,None (Open Label),OTHER,FALSE,"University of California, San Diego","University of California, San Diego",NA,NA,NA,"University of California, San Diego",2010,2009,2013
NCT01116921,2017-01-06,2010-05-03,2017-01-06,Interventional,Not Applicable,103,Completed,Laryngeal Mask Airway (LMA) for Surfactant Administration in Neonates,2011-02-01T00:00:00Z,2015-04-01T00:00:00Z,2015-04-01T00:00:00Z,TRUE,Randomized,None (Open Label),OTHER,TRUE,NA,"University of California, San Diego",NA,NA,NA,NA,2010,2011,2015
NCT01120301,2013-11-14,2010-05-05,NA,Interventional,Phase 3,1000,Completed,Efficacy and Safety Trial of Transcranial Laser Therapy Within 24 Hours From Stroke Onset (NEST-3),2010-09-01T00:00:00Z,NA,2012-09-01T00:00:00Z,FALSE,Randomized,Quadruple,INDUSTRY,TRUE,NA,NA,"University of California, San Diego",NA,NA,NA,2010,2010,NA
NCT01122095,2010-05-28,2010-04-27,NA,Observational,NA,100,Unknown status,Cross-sectional Evaluation of Biological Markers of Cardiovascular Disease in Children and Adolescents With Psoriasis,2010-04-01T00:00:00Z,2011-04-01T00:00:00Z,NA,FALSE,NA,NA,OTHER,FALSE,"University of California, San Diego",NA,NA,NA,NA,"University of California, San Diego",2010,2010,2011
NCT01123161,2017-02-18,2010-04-27,2016-09-29,Interventional,Phase 2/Phase 3,120,Terminated,The Intravascular Cooling in the Treatment of Stroke 2/3 Trial,2010-06-01T00:00:00Z,2015-05-01T00:00:00Z,2015-01-01T00:00:00Z,TRUE,Randomized,Single,OTHER,TRUE,"University of California, San Diego",NA,NA,"University of California, San Diego",NA,NA,2010,2010,2015
NCT01123512,2014-10-01,2010-05-11,2014-08-06,Interventional,Phase 3,300,Completed,The Kiva® System as a Vertebral Augmentation Treatment,2010-07-01T00:00:00Z,2013-05-01T00:00:00Z,2013-05-01T00:00:00Z,TRUE,Randomized,Single,INDUSTRY,TRUE,NA,"University of California, San Diego, CA",NA,NA,NA,NA,2010,2010,2013
NCT01134029,2014-12-03,2010-02-10,NA,Interventional,Not Applicable,262,Completed,Planned CORR: Planned Care for Obesity and Risk Reduction,2009-11-01T00:00:00Z,2013-10-01T00:00:00Z,2013-10-01T00:00:00Z,FALSE,Randomized,None (Open Label),OTHER,FALSE,"University of California, San Diego",UCSD,NA,NA,NA,"University of California, San Diego",2010,2009,2013
NCT01138553,2019-07-03,2010-06-04,NA,Interventional,Early Phase 1,4,Terminated,Preoperative Testing of the Anti-Progesterone Mifepristone in Early Stage Breast Cancer,2010-06-01T00:00:00Z,2015-10-01T00:00:00Z,2014-06-01T00:00:00Z,FALSE,NA,None (Open Label),OTHER,FALSE,"University of California, San Diego","University of California, San Diego",NA,NA,NA,"University of California, San Diego",2010,2010,2015
NCT01140568,2020-04-27,2010-06-08,2020-04-13,Interventional,Phase 2,38,Completed,Study of Platelet Derived Growth Factor Receptor (PDGFR) in Recurrent Malignant Gliomas,2010-04-21T00:00:00Z,2019-01-01T00:00:00Z,2016-10-05T00:00:00Z,TRUE,NA,None (Open Label),OTHER,FALSE,NA,NA,NA,NA,NA,"University of California, San Diego",2010,2010,2019
NCT01144559,2010-10-29,2010-06-14,NA,Interventional,Phase 4,15,Completed,Continuous Femoral Nerve Blocks: Relative Effects of Basal Infusion and Bolus Doses on Sensory and Motor Function,2010-06-01T00:00:00Z,2010-09-01T00:00:00Z,2010-09-01T00:00:00Z,FALSE,Randomized,Quadruple,OTHER,FALSE,"University of California, San Diego","University of California, San Diego",NA,NA,NA,"University of California, San Diego, Department of Anesthesiology",2010,2010,2010
NCT01145833,2020-08-18,2010-06-14,2015-12-01,Interventional,Not Applicable,50,Completed,Guided Self-help for Families With an Overweight Child,2009-10-01T00:00:00Z,2011-10-01T00:00:00Z,2011-09-01T00:00:00Z,TRUE,Randomized,None (Open Label),OTHER,FALSE,"University of California, San Diego",UCSD,NA,NA,NA,"University of California, San Diego",2010,2009,2011
NCT01150266,2013-09-11,2010-06-23,NA,Interventional,Phase 1,0,Withdrawn,Study for the Use of Alteplase in Patients Who Awaken With Stroke,2011-08-01T00:00:00Z,NA,2013-09-01T00:00:00Z,FALSE,NA,None (Open Label),OTHER,FALSE,"University of California, San Diego",NA,NA,NA,NA,"University of California, San Diego",2010,2011,NA
NCT01152684,2020-02-05,2010-06-25,NA,Observational,NA,541,Completed,Complementary & Alternative Medicine Use in HIV+ Latinos in the US-Mexico Border,2009-09-01T00:00:00Z,2013-01-01T00:00:00Z,2013-01-01T00:00:00Z,FALSE,NA,NA,OTHER,FALSE,"University of California, San Diego","University of California, San Diego",NA,NA,NA,NA,2010,2009,2013
NCT01154192,2019-04-22,2010-06-29,2019-03-29,Interventional,Phase 3,24,Completed,Theca Cell Function in Adolescents With Polycystic Ovary Syndrome (PCOS),2011-08-01T00:00:00Z,2014-09-01T00:00:00Z,2014-07-01T00:00:00Z,TRUE,Non-Randomized,None (Open Label),OTHER,FALSE,"University of California, San Diego",UCSD School of Medicine,NA,NA,NA,"University of California, San Diego",2010,2011,2014
NCT01155011,2017-08-01,2010-06-30,2017-04-10,Interventional,Not Applicable,307,Completed,Multilevel Intervention for Physical Activity in Retirement Communities,2011-01-01T00:00:00Z,2014-07-01T00:00:00Z,2014-07-01T00:00:00Z,TRUE,Randomized,Triple,OTHER,FALSE,"University of California, San Diego","University of California, San Diego",NA,NA,NA,"University of California, San Diego",2010,2011,2014
NCT01157975,2019-11-27,2010-07-06,NA,Interventional,Phase 2,0,Withdrawn,Study the Relationship Between Obesity and Hepatitis C Replication,2008-10-01T00:00:00Z,2014-09-01T00:00:00Z,2014-02-01T00:00:00Z,FALSE,Randomized,None (Open Label),OTHER,TRUE,"University of California, San Diego",UCSD,NA,NA,NA,"University of California, San Diego",2010,2008,2014
NCT01171261,2012-06-08,2010-07-23,NA,Interventional,Not Applicable,63,Completed,Testing Health Games for Adolescent Physical Activity,2008-05-01T00:00:00Z,2010-09-01T00:00:00Z,2010-09-01T00:00:00Z,FALSE,Randomized,None (Open Label),OTHER,FALSE,"University of California, San Diego",UCSD,NA,NA,NA,"University of California, San Diego",2010,2008,2010
NCT01171586,2014-12-03,2010-07-26,NA,Interventional,Not Applicable,318,Completed,mDiet: A Text Message Intervention for Weight Loss,2010-05-01T00:00:00Z,2014-06-01T00:00:00Z,2014-06-01T00:00:00Z,FALSE,Randomized,None (Open Label),OTHER,FALSE,"University of California, San Diego",UCSD,NA,NA,NA,"University of California, San Diego",2010,2010,2014
NCT01171599,2012-06-08,2010-07-23,NA,Interventional,Not Applicable,12,Completed,PACE-CALL: A Weight Control Intervention for Survivors of Childhood Leukemia,2008-08-01T00:00:00Z,2011-08-01T00:00:00Z,2011-08-01T00:00:00Z,FALSE,Non-Randomized,None (Open Label),OTHER,FALSE,"University of California, San Diego",UCSD,NA,NA,NA,"University of California, San Diego",2010,2008,2011
NCT01181596,2019-06-07,2010-08-12,2013-08-27,Observational,NA,31,Terminated,NICU-TECH RM9L-RS Probe ME Feasibility Study,2010-06-01T00:00:00Z,2011-11-01T00:00:00Z,2011-11-01T00:00:00Z,TRUE,NA,NA,INDUSTRY,FALSE,NA,UCSD Medical Center,NA,NA,NA,NA,2010,2010,2011
NCT01182766,2020-10-25,2010-08-10,NA,Interventional,Phase 2/Phase 3,294,"Active, not recruiting",New Treatment for Alcohol and Nicotine Dependence,2011-09-01T00:00:00Z,2020-12-01T00:00:00Z,2020-12-01T00:00:00Z,FALSE,Randomized,Quadruple,OTHER,TRUE,NA,"University of California, San Diego",NA,NA,NA,NA,2010,2011,2020
NCT01191190,2018-04-09,2010-08-26,2015-08-24,Interventional,Phase 2,21,Completed,Ofatumumab and High-dose Methylprednisolone in Patients With Chronic Lymphocytic Leukemia (CLL),2010-08-01T00:00:00Z,2012-08-01T00:00:00Z,2012-02-01T00:00:00Z,TRUE,NA,None (Open Label),OTHER,TRUE,NA,"University of California, San Diego; Director of the CLL Research Consortium and University of California San Diego",NA,NA,NA,"University of California, San Diego",2010,2010,2012
NCT01197443,2015-11-30,2010-08-17,NA,Interventional,Not Applicable,152,Completed,Parents as the Agent of Change for Childhood Obesity,2010-11-01T00:00:00Z,2015-07-01T00:00:00Z,2015-07-01T00:00:00Z,FALSE,Randomized,None (Open Label),OTHER,FALSE,"University of California, San Diego",UCSD,NA,NA,NA,"University of California, San Diego",2010,2010,2015
NCT01197456,2020-04-20,2010-09-08,2019-07-18,Observational,NA,232,Completed,Predictors of Ovarian Insufficiency in Young Breast Cancer Patients,2008-09-24T00:00:00Z,2019-07-18T00:00:00Z,2016-06-30T00:00:00Z,TRUE,NA,NA,OTHER,TRUE,"University of California, San Diego",NA,NA,NA,NA,"University of California, San Diego",2010,2008,2019
NCT01198418,2020-05-08,2010-09-08,NA,Interventional,Not Applicable,181,Completed,A Web-based Intervention Study to Reduce High-risk Sexual Behavior by Persons Living With HIV AIDS (PLWH),2010-07-09T00:00:00Z,2017-11-09T00:00:00Z,2017-10-18T00:00:00Z,FALSE,Randomized,None (Open Label),OTHER,TRUE,"University of California, San Diego",NA,"University of California, San Diego",NA,NA,"University of California, San Diego",2010,2010,2017
NCT01199575,2021-09-02,2010-08-31,2018-03-26,Interventional,Phase 2,30,"Active, not recruiting",Phase II Trial of Revlimid® and Rituximab for Relapsed or Refractory Chronic Lymphocytic Leukemia (CLL),2010-08-01T00:00:00Z,2024-12-01T00:00:00Z,2015-01-01T00:00:00Z,TRUE,NA,None (Open Label),OTHER,FALSE,"University of California, San Diego",NA,NA,Director of the CLL Research Consortium and University of California San Diego,NA,"University of California, San Diego",2010,2010,2024
NCT01200459,2014-12-05,2010-09-10,NA,Interventional,Not Applicable,404,Completed,SMART: A Social and Mobile Weight Control Program for Young Adults,2011-05-01T00:00:00Z,2014-06-01T00:00:00Z,2014-06-01T00:00:00Z,FALSE,Randomized,None (Open Label),OTHER,FALSE,"University of California, San Diego",NA,NA,NA,NA,"University of California, San Diego",2010,2011,2014
NCT01202175,2019-07-30,2010-06-24,2019-07-09,Interventional,Phase 4,50,Completed,Effects of the Beta-blocker Nebivolol (Bystolic) on Subjects With High Normal Blood Pressure and/or a Family History of Hypertension,2010-07-01T00:00:00Z,2013-06-01T00:00:00Z,2012-06-01T00:00:00Z,TRUE,Randomized,Single,OTHER,FALSE,"University of California, San Diego","University of California, San Diego",NA,NA,NA,"University of California, San Diego",2010,2010,2013
NCT01211756,2019-08-30,2010-09-28,2019-08-30,Interventional,Not Applicable,1,Terminated,Oxytocin Add-on for Stable Depressed Patients,2010-10-01T00:00:00Z,2015-12-01T00:00:00Z,2015-02-01T00:00:00Z,TRUE,Randomized,Triple,OTHER,FALSE,NA,"University of California, San Diego",NA,NA,NA,"University of California, San Diego",2010,2010,2015
NCT01219660,2019-06-24,2010-10-12,NA,Observational,NA,78,Completed,Obstructive Sleep Apnea (OSA) Anesthesia and Positive Airway Pressure,2009-12-01T00:00:00Z,2012-12-01T00:00:00Z,2011-12-01T00:00:00Z,FALSE,NA,NA,OTHER,TRUE,"University of California, San Diego",NA,NA,NA,NA,NA,2010,2009,2012
NCT01220739,2016-10-07,2010-10-13,2014-12-03,Interventional,Phase 2,12,Terminated,Safety of Rt-PA + Transcranial Emission of Low-Energy Lasers for Acute Stroke Recovery,2011-06-01T00:00:00Z,2013-04-01T00:00:00Z,2012-12-01T00:00:00Z,TRUE,Randomized,Quadruple,OTHER,TRUE,"University of California, San Diego","University of California, San Diego",NA,NA,NA,"University of California, San Diego",2010,2011,2013
NCT01223261,2019-03-20,2010-10-14,NA,Observational,NA,156,Completed,Observational Study of Surgical Treatment of Necrotizing Enterocolotis,2001-03-01T00:00:00Z,2004-03-01T00:00:00Z,2002-09-01T00:00:00Z,FALSE,NA,NA,NETWORK,TRUE,NA,"University of California, San Diego",NA,NA,NA,NA,2010,2001,2004
NCT01223274,2017-09-22,2010-10-14,NA,Interventional,Phase 1/Phase 2,104,Completed,Delivery Room CPAP in Extremely Low Birth Weight Infants,2002-07-01T00:00:00Z,2003-01-01T00:00:00Z,2003-01-01T00:00:00Z,FALSE,Randomized,None (Open Label),NETWORK,TRUE,NA,NA,NA,"University of California, San Diego",NA,NA,2010,2002,2003
NCT01223287,2017-09-22,2010-10-14,NA,Observational,NA,410,Completed,Physiologic Definition of Bronchopulmonary Dysplasia,2005-05-01T00:00:00Z,2008-09-01T00:00:00Z,2008-05-01T00:00:00Z,FALSE,NA,NA,NETWORK,TRUE,NA,"University of California, San Diego",NA,NA,NA,NA,2010,2005,2008
NCT01229683,2012-03-06,2010-10-27,NA,Observational,NA,62,Completed,Effects of Interscalene Brachial Plexus Nerve Blocks on the Hand and Forearm,2010-10-01T00:00:00Z,2012-03-01T00:00:00Z,2011-08-01T00:00:00Z,FALSE,NA,NA,OTHER,FALSE,"University of California, San Diego","University of California, San Diego",NA,NA,NA,"University of California, San Diego",2010,2010,2012
NCT01229696,2016-04-07,2010-10-27,NA,Interventional,Phase 4,150,Completed,Continuous Popliteal Nerve Blocks: Effect of Perineural Catheter Tip Location Relative to the Sciatic Nerve Bifurcation on Postoperative Analgesia,2010-10-01T00:00:00Z,2015-06-01T00:00:00Z,2015-06-01T00:00:00Z,FALSE,Randomized,Single,OTHER,FALSE,"University of California, San Diego","University of California, San Diego",NA,NA,NA,"University of California, San Diego",2010,2010,2015
NCT01231191,2012-03-06,2010-10-27,NA,Interventional,Phase 4,0,Withdrawn,"A Randomized, Double-Blind, Placebo-Controlled, Parallel-Group Study of the Relationship Between Intraoperative Intravenous Acetaminophen and Postoperative Opioid Avoidance for Ambulatory Surgical Procedures",NA,NA,NA,FALSE,Randomized,Double,OTHER,FALSE,"University of California, San Diego","University of California, San Diego",NA,NA,NA,"University of California, San Diego",2010,NA,NA
NCT01231204,2016-04-07,2010-10-27,NA,Interventional,Phase 4,60,Completed,Prevention of Post-Mastectomy Breast Pain Using Ambulatory Continuous Paravertebral Blocks,2010-10-01T00:00:00Z,2016-03-01T00:00:00Z,2012-11-01T00:00:00Z,FALSE,Randomized,Quadruple,OTHER,FALSE,"University of California, San Diego","University of California, San Diego, Department of Anesthesia",NA,NA,NA,"University of California, San Diego",2010,2010,2016
NCT01232361,2021-07-30,2010-10-29,NA,Observational,NA,127,Completed,IMPAACT P1080: Psychiatric and Antiretroviral Medication Concentrations in HIV-infected and Uninfected Children and Adolescents,2010-10-08T00:00:00Z,2016-07-01T00:00:00Z,2016-07-01T00:00:00Z,FALSE,NA,NA,NETWORK,TRUE,NA,NA,"University of California, San Diego/IMPAACT",NA,NA,NA,2010,2010,2016
NCT01238172,2019-02-20,2010-11-09,2019-02-20,Interventional,Phase 3,478,Completed,Diet in Altering Disease Progression in Patients With Prostate Cancer on Active Surveillance,2011-01-01T00:00:00Z,2019-01-15T00:00:00Z,2017-11-18T00:00:00Z,TRUE,Randomized,None (Open Label),OTHER,TRUE,NA,NA,"University of California, San Diego",NA,NA,NA,2010,2011,2019
NCT01245972,2019-08-14,2010-11-22,2019-07-03,Interventional,Not Applicable,23,Completed,Pilot Study of PDL to Treat BCC and SCCIS,2010-08-01T00:00:00Z,2011-06-01T00:00:00Z,2011-06-01T00:00:00Z,TRUE,Randomized,None (Open Label),OTHER,TRUE,"University of California, San Diego","UCSD Medical Center, Division of Dermatology",NA,NA,NA,"University of California, San Diego",2010,2010,2011
NCT01248156,2019-08-13,2010-11-24,NA,Observational,NA,5,Completed,The Maintenance of Human Atrial Fibrillation,2010-12-01T00:00:00Z,2014-06-01T00:00:00Z,2014-04-01T00:00:00Z,FALSE,NA,NA,OTHER,TRUE,"University of California, San Diego","University of California, San Diego",NA,NA,NA,NA,2010,2010,2014
NCT01248832,2020-02-11,2010-11-24,NA,Interventional,Not Applicable,2277,Completed,Smokers' Quitline for Asian Language Speakers,2004-08-01T00:00:00Z,2008-11-01T00:00:00Z,2008-04-01T00:00:00Z,FALSE,Randomized,None (Open Label),OTHER,FALSE,"University of California, San Diego","University of California, San Diego",NA,NA,NA,"University of California, San Diego",2010,2004,2008
NCT01251406,2021-04-22,2010-11-17,NA,Interventional,Phase 2,67,Completed,Efficacy and Safety of Human Neuregulin-1 to Treat Stable Chronic Heart Failure,2012-01-01T00:00:00Z,2014-03-01T00:00:00Z,2012-12-01T00:00:00Z,FALSE,Randomized,Quadruple,INDUSTRY,TRUE,NA,NA,"University of California, San Diego",NA,NA,NA,2010,2012,2014
NCT01253733,2016-01-25,2010-11-30,NA,Interventional,Not Applicable,81,Completed,MD2Me - Texting to Promote Chronic Disease Management,2009-10-01T00:00:00Z,2012-03-01T00:00:00Z,2012-03-01T00:00:00Z,FALSE,Randomized,None (Open Label),INDIV,FALSE,NA,"University of California, San Diego",NA,NA,NA,NA,2010,2009,2012
NCT01256827,2013-11-12,2010-12-07,NA,Observational,NA,65,Completed,Seven Year Update of Macular Degeneration Patients,2010-12-01T00:00:00Z,2013-04-01T00:00:00Z,2012-10-01T00:00:00Z,FALSE,NA,NA,OTHER,TRUE,NA,NA,NA,"University of California San Diego, Shiley Eye Center",NA,NA,2010,2010,2013
NCT01258465,2010-12-10,2010-12-10,NA,Interventional,Not Applicable,39,Completed,Research in Autism: Parent Intervention,2005-01-01T00:00:00Z,2009-12-01T00:00:00Z,2009-12-01T00:00:00Z,FALSE,Randomized,None (Open Label),OTHER,TRUE,"University of California, San Diego","University of California, San Diego",NA,NA,NA,"University of California, San Diego",2010,2005,2009
NCT01263249,2011-06-13,2010-12-16,NA,Interventional,Phase 4,19,Completed,Effects of Catheter Tip Location Relative to the Femoral Nerve on Sensory and Motor Function,2010-01-01T00:00:00Z,2011-06-01T00:00:00Z,2011-04-01T00:00:00Z,FALSE,Randomized,Triple,OTHER,FALSE,"University of California, San Diego","University of California, San Diego",NA,NA,NA,"University of California, San Diego, Department of Anesthesiology",2010,2010,2011
NCT01271686,2014-05-19,2011-01-06,2013-12-17,Interventional,Phase 4,16,Completed,24-hour IOP-lowering Effect of 0.01% Bimatoprost,2011-01-01T00:00:00Z,2012-10-01T00:00:00Z,2012-10-01T00:00:00Z,TRUE,NA,None (Open Label),OTHER,FALSE,"University of California, San Diego","University of California, San Diego",NA,NA,NA,"University of California, San Diego",2011,2011,2012
NCT01272531,2020-06-04,2011-01-06,NA,Observational,NA,560,Completed,Pharmacogenomics of Mood Stabilizer Response in Bipolar Disorder (PGBD),2011-04-01T00:00:00Z,2016-04-01T00:00:00Z,2016-04-01T00:00:00Z,FALSE,NA,NA,OTHER,TRUE,"University of California, San Diego","University of California, San Diego",NA,NA,NA,"University of California, San Diego",2011,2011,2016
