nct_id,last_update_submitted_date,registration_date,summary_results_date,study_type,phase,enrollment,recruitment_status,title,start_date,completion_date,primary_completion_date,has_summary_results,allocation,masking,main_sponsor,is_multicentric,ucsd_lead_sponsor,ucsd_principal_investigator,ucsd_study_chair,ucsd_study_director,ucsd_unspecified_official,ucsd_responsible_party,registration_year,start_year,completion_year
NCT02217436,2019-07-03,2014-08-08,2018-06-28,Interventional,Not Applicable,80,Completed,iPad as a Distraction Tool During Facial Laceration Repair,2014-04-01T00:00:00Z,2015-07-01T00:00:00Z,2015-07-01T00:00:00Z,TRUE,Randomized,None (Open Label),OTHER,FALSE,"University of California, San Diego","University of California, San Diego and Rady Children's Hospital San Diego",NA,NA,NA,"University of California, San Diego",2014,2014,2015
NCT02219269,2018-03-13,2014-08-11,NA,Observational,NA,97,Completed,A Complex Contraception Registry,2014-06-01T00:00:00Z,2015-06-01T00:00:00Z,2015-06-01T00:00:00Z,FALSE,NA,NA,OTHER,TRUE,"University of California, San Diego",UCSD,NA,NA,NA,"University of California, San Diego",2014,2014,2015
NCT02219308,2019-10-10,2014-08-11,2019-06-06,Interventional,Not Applicable,67,Completed,Pain Control for Intrauterine Device Placement Using Paracervical Block,2014-10-01T00:00:00Z,2017-10-01T00:00:00Z,2017-10-01T00:00:00Z,TRUE,Randomized,Single,OTHER,TRUE,"University of California, San Diego",UCSD,NA,NA,NA,"University of California, San Diego",2014,2014,2017
NCT02219438,2021-03-18,2014-08-14,2019-07-17,Interventional,Phase 4,24,Completed,Continuous Adductor Canal Nerve Blocks: Relative Effects of a Basal Infusion v. Hourly Bolus Doses,2014-08-01T00:00:00Z,2014-12-01T00:00:00Z,2014-12-01T00:00:00Z,TRUE,Randomized,Quadruple,OTHER,FALSE,"University of California, San Diego",NA,NA,NA,NA,"University of California, San Diego",2014,2014,2014
NCT02222688,2020-07-29,2014-08-19,2019-06-19,Interventional,Phase 1,26,Completed,UC-961 (Cirmtuzumab) in Relapsed or Refractory Chronic Lymphocytic Leukemia,2014-08-08T00:00:00Z,2018-05-01T00:00:00Z,2017-10-10T00:00:00Z,TRUE,Non-Randomized,None (Open Label),OTHER,FALSE,NA,NA,NA,NA,NA,"University of California, San Diego",2014,2014,2018
NCT02229175,2020-07-29,2014-08-14,NA,Interventional,Phase 2/Phase 3,0,Withdrawn,Laser vs Bevacizumab Injection Alone in Treatment of Diabetic Macular Edema,2021-01-01T00:00:00Z,2027-01-01T00:00:00Z,2026-01-01T00:00:00Z,FALSE,Randomized,Double,OTHER,FALSE,NA,"University of California, San Diego",NA,NA,NA,NA,2014,2021,2027
NCT02229422,2021-09-02,2014-08-27,NA,Interventional,Phase 1/Phase 2,40,"Active, not recruiting",A Study of Obinutuzumab(GA101) in Combination With High-Dose Methylprednisolone(HDMP) in Chronic Lymphocytic Leukemia(CLL) Patients (GA101 & HDMP),2014-09-01T00:00:00Z,2025-12-25T00:00:00Z,2025-10-30T00:00:00Z,FALSE,NA,None (Open Label),OTHER,FALSE,"University of California, San Diego","University of California, San Diego",NA,NA,NA,"University of California, San Diego",2014,2014,2025
NCT02241226,2015-12-14,2014-09-09,NA,Interventional,Not Applicable,115,Completed,Self-Directed Biological Transformation Initiative,2014-09-01T00:00:00Z,2015-02-01T00:00:00Z,2015-02-01T00:00:00Z,FALSE,Randomized,None (Open Label),OTHER,FALSE,"University of California, San Diego","Chopra Center for Wellbeing & University of California, San Diego","Chopra Center for Wellbeing & University of California, San Diego","University of California, San Diego",NA,"University of California, San Diego",2014,2014,2015
NCT02244957,2020-07-13,2014-09-15,2020-05-14,Interventional,Not Applicable,23,Completed,Right Ventricular Hemodynamics Using Cardiac MRI in Patients COPD and OSA,2014-09-01T00:00:00Z,2020-02-01T00:00:00Z,2017-02-01T00:00:00Z,TRUE,Randomized,None (Open Label),OTHER,FALSE,"University of California, San Diego",UCSD,NA,NA,NA,"University of California, San Diego",2014,2014,2020
NCT02245607,2021-02-03,2014-09-16,NA,Interventional,Not Applicable,120,"Active, not recruiting",Compensatory Cognitive Training in Clinical High Risk Latino Youth,2014-10-01T00:00:00Z,2021-02-01T00:00:00Z,2020-06-30T00:00:00Z,FALSE,Randomized,Single,OTHER,TRUE,"University of California, San Diego","University of California, San Diego",NA,NA,NA,"University of California, San Diego",2014,2014,2021
NCT02251236,2019-10-08,2014-09-24,2019-10-08,Interventional,Not Applicable,14,Completed,Elvitegravir (EVG) Cerebrospinal Fluid (CSF) Pharmacokinetics in HIV-Infected Individuals,2016-01-01T00:00:00Z,2017-01-18T00:00:00Z,2017-01-18T00:00:00Z,TRUE,Non-Randomized,None (Open Label),OTHER,FALSE,"University of California, San Diego",UCSD,NA,NA,NA,"University of California, San Diego",2014,2016,2017
NCT02254902,2016-05-11,2014-09-29,NA,Interventional,Not Applicable,27,Terminated,Physical Activity and Education Program for Somali Women,2014-09-01T00:00:00Z,2015-12-01T00:00:00Z,2015-12-01T00:00:00Z,FALSE,Randomized,None (Open Label),OTHER,FALSE,"University of California, San Diego","University of California, San Diego",NA,NA,NA,"University of California, San Diego",2014,2014,2015
NCT02255825,2019-06-04,2014-09-24,NA,Interventional,Not Applicable,0,Withdrawn,Development of an Optimal Approach to Return of Results for Next-generation Sequencing for Prenatal Diagnosis,2014-10-01T00:00:00Z,2019-06-04T00:00:00Z,2019-06-04T00:00:00Z,FALSE,Non-Randomized,None (Open Label),OTHER,FALSE,"University of California, San Diego",NA,NA,NA,NA,"University of California, San Diego",2014,2014,2019
NCT02263001,2017-05-02,2014-10-03,NA,Interventional,Not Applicable,8,Completed,Acupuncture Therapy for Treatment of Musculoskeletal Pain,2013-04-01T00:00:00Z,2016-12-01T00:00:00Z,2016-12-01T00:00:00Z,FALSE,Randomized,None (Open Label),OTHER,FALSE,"University of California, San Diego",NA,NA,NA,NA,"University of California, San Diego",2014,2013,2016
NCT02264353,2019-08-06,2014-09-17,2017-03-02,Interventional,Phase 4,44,Completed,The Impact of Arousal Threshold in Obstructive Sleep Apnea,2014-09-01T00:00:00Z,2015-05-01T00:00:00Z,2015-05-01T00:00:00Z,TRUE,Randomized,Triple,OTHER,FALSE,"University of California, San Diego","University of California, San Diego",NA,NA,NA,"University of California, San Diego",2014,2014,2015
NCT02266108,2019-10-15,2014-10-10,2018-10-25,Interventional,Not Applicable,151,Completed,Economic and Social Empowerment To Increase Upwards Mobility Among Women,2014-08-01T00:00:00Z,2018-09-30T00:00:00Z,2018-09-30T00:00:00Z,TRUE,Randomized,Single,OTHER,FALSE,"University of California, San Diego","University of California, San Diego",NA,NA,NA,"University of California, San Diego",2014,2014,2018
NCT02280395,2021-01-11,2014-10-26,NA,Interventional,Phase 1/Phase 2,9,Terminated,"A Phase I/II Double-Blind, Randomized, Controlled Study to Evaluate the Safety and Efficacy of RUT058-60",2014-10-01T00:00:00Z,2015-06-01T00:00:00Z,2015-06-01T00:00:00Z,FALSE,Randomized,Double,INDUSTRY,TRUE,NA,"University of California, San Diego",NA,NA,NA,NA,2014,2014,2015
NCT02292056,2014-11-14,2014-11-12,NA,Interventional,Not Applicable,50,Unknown status,Medication Safety and Contraceptive Counseling for Reproductive Aged Women With Psychiatric Conditions,2013-09-01T00:00:00Z,2015-10-01T00:00:00Z,2015-10-01T00:00:00Z,FALSE,NA,None (Open Label),OTHER,FALSE,"University of California, San Diego",UCSD Department of Reproductive Medicine,NA,NA,NA,"University of California, San Diego",2014,2013,2015
NCT02293213,2019-06-06,2014-11-13,NA,Interventional,Not Applicable,33,Completed,EMR Referrals for Teratogen and Contraceptive Counseling for Category D or X Medication Users: RCT,2012-04-01T00:00:00Z,2013-10-01T00:00:00Z,2013-10-01T00:00:00Z,FALSE,Randomized,None (Open Label),OTHER,FALSE,"University of California, San Diego",UCSD Department of Reproductive Medicine,NA,NA,NA,"University of California, San Diego",2014,2012,2013
NCT02297737,2016-05-05,2014-09-19,NA,Interventional,Not Applicable,75,Unknown status,Mindful Movement Intervention for Post-MI Patients,2013-10-01T00:00:00Z,2016-12-01T00:00:00Z,2016-06-01T00:00:00Z,FALSE,Randomized,Double,FED,TRUE,NA,"University of California, San Diego",NA,NA,NA,NA,2014,2013,2016
NCT02303626,2016-02-15,2014-11-24,NA,Interventional,Phase 2/Phase 3,110,Completed,12-Week Safety and Efficacy Study of BCX4161 as an Oral Prophylaxis Against HAE Attacks,2014-11-01T00:00:00Z,2016-01-01T00:00:00Z,2016-01-01T00:00:00Z,FALSE,Randomized,Quadruple,INDUSTRY,TRUE,NA,UCSD,NA,NA,NA,NA,2014,2014,2016
NCT02315768,2021-04-08,2014-10-30,NA,Interventional,Phase 1/Phase 2,32,"Active, not recruiting",Ibrutinib in Combination With GA101 (Obinutuzumab) in Previously Untreated Chronic Lymphocytic Leukemia (CLL) Patients.,2015-11-01T00:00:00Z,2022-11-01T00:00:00Z,2022-11-01T00:00:00Z,FALSE,NA,None (Open Label),OTHER,FALSE,"University of California, San Diego","University of California, San Diego",NA,NA,NA,"University of California, San Diego",2014,2015,2022
NCT02317523,2019-09-24,2014-12-11,NA,Interventional,Not Applicable,151,Completed,Alzheimer's Caregiver Coping: Mental and Physical Health,2014-09-01T00:00:00Z,2019-06-30T00:00:00Z,2019-06-30T00:00:00Z,FALSE,Randomized,Single,OTHER,FALSE,"University of California, San Diego","University of California, San Diego",NA,NA,NA,"University of California, San Diego",2014,2014,2019
NCT02326649,2017-02-28,2014-12-15,2017-02-28,Observational,NA,21,Completed,Noninvasive Measurement of CO Using Impedance Cardiography in Patients With CHD,2014-12-01T00:00:00Z,2016-03-01T00:00:00Z,2016-02-01T00:00:00Z,TRUE,NA,NA,OTHER,FALSE,"University of California, San Diego",NA,NA,NA,NA,"University of California, San Diego",2014,2014,2016
NCT02327637,2019-06-04,2014-12-19,NA,Interventional,Not Applicable,5,Terminated,A Comparison of Bed Rest Versus Moderate Activity in Preterm Premature Rupture of Membranes (PPROM),2014-12-01T00:00:00Z,2016-12-12T00:00:00Z,2016-12-12T00:00:00Z,FALSE,Randomized,None (Open Label),OTHER,FALSE,"University of California, San Diego","University of California, San Diego",NA,NA,NA,"University of California, San Diego",2014,2014,2016
NCT02330627,2021-11-05,2014-12-24,2019-05-01,Interventional,Not Applicable,29,Completed,Positive Valence System Enhancement Treatment for Anxiety and Depression: Clinical Efficacy and Neural Changes,2014-04-01T00:00:00Z,2016-03-01T00:00:00Z,2015-07-01T00:00:00Z,TRUE,Randomized,Single,OTHER,FALSE,"University of California, San Diego","University of California, San Diego",NA,NA,NA,"University of California, San Diego",2014,2014,2016
NCT02330744,2017-08-31,2014-12-24,NA,Interventional,Not Applicable,40,Completed,The Neurobiology of Approach Avoidance Training in Depression,2014-07-01T00:00:00Z,2017-07-01T00:00:00Z,2017-04-01T00:00:00Z,FALSE,Randomized,Double,OTHER,FALSE,"University of California, San Diego","University of California, San Diego",NA,NA,NA,"University of California, San Diego",2014,2014,2017
NCT02332876,2018-07-09,2014-12-23,2018-06-11,Interventional,Not Applicable,87,Completed,Physical Activity and Neuropsychological Outcomes in a Cancer Population,2014-08-01T00:00:00Z,2016-07-01T00:00:00Z,2016-07-01T00:00:00Z,TRUE,Randomized,NA,OTHER,FALSE,"University of California, San Diego",NA,NA,NA,NA,"University of California, San Diego",2014,2014,2016
NCT02354092,2019-05-21,2015-01-29,2018-09-24,Interventional,Not Applicable,14,Terminated,Paracervical Block for Pain Control With Osmotic Dilator Placement,2015-04-02T00:00:00Z,2015-08-25T00:00:00Z,2015-08-25T00:00:00Z,TRUE,Randomized,Single,OTHER,TRUE,"University of California, San Diego",UCSD Department of Reproductive Medicine,NA,NA,NA,"University of California, San Diego",2015,2015,2015
NCT02367599,2020-06-18,2015-02-10,2020-05-13,Interventional,Phase 4,48,Completed,Effect of Vitamin D Supplementation on Bone Turnover Markers During PrEP in MSM,2014-12-15T00:00:00Z,2018-07-11T00:00:00Z,2018-06-13T00:00:00Z,TRUE,Non-Randomized,None (Open Label),OTHER,TRUE,"University of California, San Diego",NA,NA,NA,NA,"University of California, San Diego",2015,2014,2018
NCT02371577,2017-04-26,2015-02-13,NA,Interventional,Phase 2,0,Withdrawn,Evaluation of the Immune Restoration Potential Of Lenalidomide,2017-02-01T00:00:00Z,2020-12-01T00:00:00Z,2018-12-01T00:00:00Z,FALSE,NA,None (Open Label),OTHER,FALSE,"University of California, San Diego",NA,NA,NA,NA,"University of California, San Diego",2015,2017,2020
NCT02371590,2018-02-21,2015-02-13,NA,Interventional,Phase 2,0,Withdrawn,Lenalidomide and Obinutuzumab for Previously Untreated CLL,2018-02-01T00:00:00Z,2022-12-01T00:00:00Z,2019-12-01T00:00:00Z,FALSE,NA,None (Open Label),OTHER,FALSE,"University of California, San Diego",NA,NA,NA,NA,"University of California, San Diego",2015,2018,2022
NCT02384200,2019-08-07,2015-02-22,2019-07-14,Interventional,Phase 4,86,Completed,A Randomized Trial of Preoperative Prophylactic Antibiotics Prior to Kidney Stone Surgery (Percutaneous Nephrolithotomy [PCNL]),2015-03-01T00:00:00Z,2019-06-01T00:00:00Z,2017-02-01T00:00:00Z,TRUE,Randomized,None (Open Label),OTHER,TRUE,"University of California, San Diego","University of California, San Diego",NA,"University of California, San Diego",NA,"University of California, San Diego",2015,2015,2019
NCT02389088,2016-02-09,2015-03-09,2015-05-26,Interventional,Not Applicable,9,Completed,Effect of Increased Circulating Androgens on Granulosa Cell Responses to FSH.,2006-04-01T00:00:00Z,2013-01-01T00:00:00Z,2013-01-01T00:00:00Z,TRUE,Non-Randomized,None (Open Label),OTHER,TRUE,"University of California, San Diego","University of California, San Diego",NA,NA,NA,"University of California, San Diego",2015,2006,2013
NCT02403817,2019-12-03,2015-03-23,2019-08-08,Interventional,Not Applicable,30,Completed,Training Attention and Eye Movement in ASD,2015-11-01T00:00:00Z,2018-08-31T00:00:00Z,2018-08-31T00:00:00Z,TRUE,Non-Randomized,None (Open Label),OTHER,FALSE,"University of California, San Diego","University of California, San Diego",NA,NA,NA,"University of California, San Diego",2015,2015,2018
NCT02405325,2021-07-09,2015-03-20,2021-06-17,Interventional,Not Applicable,476,Completed,Peer Empowerment Program for Physical Activity in Low Income and Minority Seniors,2015-07-01T00:00:00Z,2020-03-17T00:00:00Z,2020-03-17T00:00:00Z,TRUE,Randomized,Single,OTHER,FALSE,"University of California, San Diego",NA,NA,NA,NA,"University of California, San Diego",2015,2015,2020
NCT02416323,2018-07-05,2015-04-07,NA,Interventional,Not Applicable,609,Completed,Effectiveness and Implementation of a Mental Health Intervention for ASD,2012-04-01T00:00:00Z,2018-02-01T00:00:00Z,2018-02-01T00:00:00Z,FALSE,Randomized,Single,OTHER,FALSE,"University of California, San Diego",NA,NA,NA,NA,"University of California, San Diego",2015,2012,2018
NCT02420509,2019-10-29,2015-04-14,NA,Observational,NA,2,Terminated,Postoperative Chemotherapy in High-Grade Appendiceal Adenocarcinoma With Peritoneal Carcinomatosis,2015-08-27T00:00:00Z,2019-04-02T00:00:00Z,2017-02-09T00:00:00Z,FALSE,NA,NA,OTHER,FALSE,"University of California, San Diego","University of California, San Diego",NA,NA,NA,"University of California, San Diego",2015,2015,2019
NCT02425345,2022-03-15,2015-04-16,NA,Interventional,Not Applicable,49331,"Active, not recruiting",Women's Health Initiative Strong and Healthy Study,2015-04-02T00:00:00Z,2024-12-01T00:00:00Z,2024-12-01T00:00:00Z,FALSE,Randomized,Single,OTHER,TRUE,NA,"University of California, San Diego",NA,NA,NA,NA,2015,2015,2024
NCT02429284,2020-03-23,2015-04-13,NA,Observational,NA,754,Completed,U.S. CTEPH Registry,2015-04-01T00:00:00Z,2019-11-01T00:00:00Z,2019-05-01T00:00:00Z,FALSE,NA,NA,OTHER,FALSE,"University of California, San Diego","University of California, San Diego",NA,NA,NA,"University of California, San Diego",2015,2015,2019
NCT02433691,2018-04-30,2015-04-13,NA,Interventional,Not Applicable,60,Completed,Memory and Exercise Training Study in Older Adults With Subjective Memory Complaints,2015-01-01T00:00:00Z,2017-06-01T00:00:00Z,2017-06-01T00:00:00Z,FALSE,Randomized,Single,OTHER,FALSE,NA,UCSD,NA,NA,NA,NA,2015,2015,2017
NCT02444403,2020-12-15,2015-05-12,NA,Interventional,Not Applicable,500,Completed,Police Training to Reduce Occupational Needlesticks and HIV Among Substance Users,2015-06-01T00:00:00Z,2018-05-29T00:00:00Z,2018-05-29T00:00:00Z,FALSE,NA,None (Open Label),OTHER,FALSE,"University of California, San Diego","Associate Professor of Law and Health Sciences, School of Law & Bouvé College of Health Sciences, Northeastern University, Adjunct Professor, Division of Global Public Health, University of California San Diego Department of Medicine; Associate Dean of Global Health Sciences, Harold Simon Professor, Chief, Division of Global Public Health, University of California San Diego, Department of Medicine",NA,NA,NA,"University of California, San Diego",2015,2015,2018
NCT02444793,2019-02-13,2015-05-12,2018-09-26,Interventional,Phase 1,24,Terminated,A Study of PF-05082566 In Combination With Mogamulizumab In Patients With Advanced Solid Tumors,2015-05-01T00:00:00Z,2017-10-01T00:00:00Z,2017-09-01T00:00:00Z,TRUE,NA,None (Open Label),INDUSTRY,TRUE,NA,"University of California, San Diego",NA,NA,NA,NA,2015,2015,2017
NCT02447484,2021-09-28,2015-05-14,NA,Interventional,Not Applicable,600,Completed,Texting Intervention to Sustain HIV Prevention in Women in High-drug-use Contexts,2015-07-01T00:00:00Z,2021-08-01T00:00:00Z,2021-04-30T00:00:00Z,FALSE,Randomized,Single,OTHER,FALSE,"University of California, San Diego","University of California, San Diego",NA,NA,NA,"University of California, San Diego",2015,2015,2021
NCT02454140,2021-05-03,2015-01-11,NA,Interventional,Not Applicable,40,"Active, not recruiting",Stereotactic Body Radiotherapy Dose Escalation in Pancreatic Cancer,2014-06-20T00:00:00Z,2021-12-31T00:00:00Z,2021-12-31T00:00:00Z,FALSE,Non-Randomized,None (Open Label),OTHER,FALSE,"University of California, San Diego","University of California, San Diego",NA,NA,NA,"University of California, San Diego",2015,2014,2021
NCT02460692,2021-03-11,2015-05-29,NA,Interventional,Phase 2,131,Completed,Trial of Dronabinol and Vaporized Cannabis in Neuropathic Low Back Pain,2016-12-01T00:00:00Z,2020-03-25T00:00:00Z,2020-03-25T00:00:00Z,FALSE,Randomized,Triple,OTHER,FALSE,"University of California, San Diego",NA,NA,NA,NA,"University of California, San Diego",2015,2016,2020
NCT02463422,2020-02-27,2015-05-27,NA,Observational,NA,12000,Unknown status,Detection of ASD at the 1st Birthday as Standard of Care: The Get SET Early Model,2014-08-01T00:00:00Z,2020-06-01T00:00:00Z,2020-06-01T00:00:00Z,FALSE,NA,NA,OTHER,TRUE,"University of California, San Diego","University of California, San Diego",NA,NA,NA,"University of California, San Diego",2015,2014,2020
NCT02463877,2019-07-01,2015-04-20,NA,Interventional,Phase 1,25,"Active, not recruiting",A Minimally-invasive Approach to Cytoreduction and HIPEC for Peritoneal Surface Malignancy,2014-10-01T00:00:00Z,2023-09-05T00:00:00Z,2023-09-01T00:00:00Z,FALSE,NA,None (Open Label),OTHER,FALSE,"University of California, San Diego","University of California, San Diego",NA,NA,NA,"University of California, San Diego",2015,2014,2023
NCT02467036,2017-10-16,2014-10-28,NA,Interventional,Not Applicable,66,Completed,Family Based Treatment for Weight Loss With Breakfast Prescription,2014-01-01T00:00:00Z,2017-09-01T00:00:00Z,2017-09-01T00:00:00Z,FALSE,Randomized,None (Open Label),OTHER,FALSE,"University of California, San Diego",UCSD,NA,NA,NA,"University of California, San Diego",2014,2014,2017
NCT02467166,2021-05-28,2015-06-03,2021-04-05,Interventional,Not Applicable,40,Completed,Evaluation of the CIRCA Monitoring System in Prevention of Esophageal Lesions Following RFCA,2015-06-01T00:00:00Z,2020-05-05T00:00:00Z,2020-03-30T00:00:00Z,TRUE,NA,None (Open Label),OTHER,FALSE,"University of California, San Diego",NA,NA,NA,NA,"University of California, San Diego",2015,2015,2020
NCT02467179,2019-06-07,2015-06-03,2019-05-13,Interventional,Not Applicable,50,Completed,Evaluation of the Amigo Robotic System for Ablation of the Cavo-Tricuspid Isthmus,2015-03-01T00:00:00Z,2018-03-30T00:00:00Z,2017-10-30T00:00:00Z,TRUE,Randomized,None (Open Label),OTHER,FALSE,"University of California, San Diego",NA,NA,NA,NA,"University of California, San Diego",2015,2015,2018
NCT02478931,2021-04-01,2015-05-22,NA,Observational,NA,10000,Recruiting,Study of Personalized Cancer Therapy to Determine Response and Toxicity,2013-09-05T00:00:00Z,2026-09-05T00:00:00Z,2025-09-05T00:00:00Z,FALSE,NA,NA,OTHER,TRUE,NA,"University of California, San Diego",NA,NA,NA,"University of California, San Diego",2015,2013,2026
NCT02481544,2019-10-07,2015-06-23,NA,Interventional,Not Applicable,108,Completed,The Effects of Journaling on Health-Related Mood and Clinical Outcomes in Post-MI Patients,2015-04-01T00:00:00Z,2019-01-01T00:00:00Z,2018-12-01T00:00:00Z,FALSE,Randomized,Single,OTHER,FALSE,"University of California, San Diego",NA,NA,NA,NA,"University of California, San Diego",2015,2015,2019
NCT02484300,2020-12-18,2015-06-19,NA,Interventional,Not Applicable,20,Completed,The Effect of Melatonin on Sleep and Ventilatory Control in Obstructive Sleep Apnea,2015-07-01T00:00:00Z,2017-11-01T00:00:00Z,2017-11-01T00:00:00Z,FALSE,Randomized,Triple,OTHER,FALSE,"University of California, San Diego",NA,NA,NA,NA,"University of California, San Diego",2015,2015,2017
NCT02485756,2019-06-06,2013-09-26,NA,Interventional,Not Applicable,42,Completed,Counseling on the Interaction of Hormonal Contraceptives and Antiepileptics,2013-06-01T00:00:00Z,2014-05-01T00:00:00Z,2014-05-01T00:00:00Z,FALSE,Randomized,None (Open Label),OTHER,FALSE,"University of California, San Diego",NA,NA,UCSD,NA,"University of California, San Diego",2013,2013,2014
NCT02486042,2021-12-13,2015-06-26,NA,Interventional,Phase 2,47,Completed,Omega-3 Long Chain Polyunsaturated Fatty Acid (LCPUFA) Supplementation in Very Low Birth Weight Infants for The Prevention Retinopathy of Prematurity,2014-03-01T00:00:00Z,2019-12-01T00:00:00Z,2019-12-01T00:00:00Z,FALSE,Randomized,Single,OTHER,FALSE,"University of California, San Diego","University of California, San Diego",NA,NA,NA,"University of California, San Diego",2015,2014,2019
NCT02490527,2021-09-27,2015-06-17,NA,Interventional,Not Applicable,19,Completed,Effects of Epicatechin on Statins for Mitochondrial Dysfunction and Impaired Exercise Capacity,2015-06-01T00:00:00Z,2021-07-28T00:00:00Z,2021-07-28T00:00:00Z,FALSE,Randomized,Double,OTHER,FALSE,"University of California, San Diego","University of California, San Diego",NA,NA,NA,"University of California, San Diego",2015,2015,2021
NCT02495883,2020-12-01,2013-09-26,2020-05-27,Interventional,Phase 4,56,Completed,Functional Imaging of Tremor Circuits and Mechanisms of Treatment Response,2013-12-01T00:00:00Z,2017-04-01T00:00:00Z,2017-04-01T00:00:00Z,TRUE,Randomized,None (Open Label),OTHER,FALSE,"University of California, San Diego",UCSD,NA,NA,NA,"University of California, San Diego",2013,2013,2017
NCT02499432,2015-07-15,2012-11-29,NA,Interventional,Not Applicable,54,Completed,Improving Implementation of Evidence Based PTSD Psychotherapy for Veterans in the Community,2013-01-01T00:00:00Z,2013-08-01T00:00:00Z,2013-08-01T00:00:00Z,FALSE,Randomized,Single,OTHER,FALSE,NA,San Diego VA Healthcare System/UCSD/VMRF,NA,NA,NA,NA,2012,2013,2013
NCT02501889,2017-10-24,2015-07-09,NA,Interventional,Not Applicable,100,Completed,The Lean Living Study,2015-08-01T00:00:00Z,2017-06-01T00:00:00Z,2017-06-01T00:00:00Z,FALSE,Randomized,None (Open Label),OTHER,FALSE,"University of California, San Diego","University of California, San Diego",NA,NA,NA,"University of California, San Diego",2015,2015,2017
NCT02502942,2019-11-25,2015-07-12,NA,Interventional,Not Applicable,134,Completed,Effects of Upper Airway Muscle Training on OSA,2015-08-01T00:00:00Z,2019-06-24T00:00:00Z,2019-06-24T00:00:00Z,FALSE,Randomized,Single,OTHER,FALSE,"University of California, San Diego","University of California, San Diego",NA,NA,NA,"University of California, San Diego",2015,2015,2019
NCT02505594,2018-01-03,2015-07-12,NA,Observational,NA,29,Completed,Potential Mechanism of Exercise Impairment in OSA,2015-07-01T00:00:00Z,2017-05-09T00:00:00Z,2017-05-09T00:00:00Z,FALSE,NA,NA,OTHER,FALSE,"University of California, San Diego","University of California, San Diego",NA,NA,NA,"University of California, San Diego",2015,2015,2017
NCT02508259,2019-06-21,2015-07-22,2017-05-01,Interventional,Phase 1/Phase 2,10,Completed,"University of California, San Diego (UCSD) Suramin Autism Treatment-1 (SAT1) Trial",2015-05-01T00:00:00Z,2016-04-01T00:00:00Z,2016-03-01T00:00:00Z,TRUE,Randomized,Quadruple,OTHER,FALSE,"University of California, San Diego","University of California, San Diego",NA,NA,NA,"University of California, San Diego",2015,2015,2016
NCT02512419,2019-06-21,2015-07-29,2019-05-30,Interventional,Not Applicable,48,Completed,Developing a Text-Message Enhanced Physical Activity Intervention for Latino Men,2015-07-01T00:00:00Z,2017-12-31T00:00:00Z,2017-10-31T00:00:00Z,TRUE,Randomized,None (Open Label),OTHER,FALSE,"University of California, San Diego","University of California, San Diego",NA,NA,NA,"University of California, San Diego",2015,2015,2017
NCT02512432,2021-11-01,2015-07-29,NA,Interventional,Not Applicable,1000,Not yet recruiting,INTACS (Intrastromal Corneal Ring Segments) For Corneal Ectasia,2021-12-01T00:00:00Z,2025-06-01T00:00:00Z,2021-12-01T00:00:00Z,FALSE,NA,None (Open Label),OTHER,TRUE,"University of California, San Diego","University of California, San Diego, Shiley Eye Institute",NA,NA,NA,"University of California, San Diego",2015,2021,2025
NCT02513121,2020-01-16,2015-07-29,2019-06-26,Interventional,Not Applicable,40,Completed,Dietary Treatment Study of Pediatric NAFLD,2015-07-01T00:00:00Z,2017-08-31T00:00:00Z,2017-08-31T00:00:00Z,TRUE,Randomized,None (Open Label),OTHER,TRUE,"University of California, San Diego","University of California, San Diego",NA,NA,NA,"University of California, San Diego",2015,2015,2017
