nct_id,last_update_submitted_date,registration_date,summary_results_date,study_type,phase,enrollment,recruitment_status,title,start_date,completion_date,primary_completion_date,has_summary_results,allocation,masking,main_sponsor,is_multicentric,ucsd_lead_sponsor,ucsd_principal_investigator,ucsd_study_chair,ucsd_study_director,ucsd_unspecified_official,ucsd_responsible_party,registration_year,start_year,completion_year
NCT03226730,2021-04-23,2016-10-07,NA,Interventional,Not Applicable,2440,Enrolling by invitation,Evaluating Household Visits and Small Groups to Increase Contraception Use Among Married Adolescent Girls in Rural Niger,2016-05-01T00:00:00Z,2022-05-01T00:00:00Z,2022-05-01T00:00:00Z,FALSE,Randomized,None (Open Label),OTHER,TRUE,"University of California, San Diego","Center on Gender Equity and Health, University of California, San Diego",NA,NA,NA,"University of California, San Diego",2016,2016,2022
NCT03235466,2020-12-03,2017-07-15,NA,Interventional,Not Applicable,45,Recruiting,A Prospective Trial of Behavioral Therapy for Chronic Cough,2018-02-01T00:00:00Z,2021-12-01T00:00:00Z,2021-06-01T00:00:00Z,FALSE,Randomized,Single,OTHER,FALSE,"University of California, San Diego",NA,NA,NA,NA,"University of California, San Diego",2017,2018,2021
NCT03252223,2021-09-06,2017-08-08,NA,Interventional,Phase 4,33,Completed,Ovarian Response to Recombinant Follicle Stimulating Hormone in Women With PCOS,2017-10-02T00:00:00Z,2021-06-30T00:00:00Z,2021-06-30T00:00:00Z,FALSE,Non-Randomized,None (Open Label),OTHER,FALSE,"University of California, San Diego","University of California, San Diego",NA,NA,NA,"University of California, San Diego",2017,2017,2021
NCT03254576,2021-06-01,2017-08-16,NA,Observational,NA,132,Recruiting,Cue-Reward Learning and Weight Gain in Youth,2016-12-01T00:00:00Z,2023-12-01T00:00:00Z,2021-11-01T00:00:00Z,FALSE,NA,NA,OTHER,FALSE,"University of California, San Diego",UCSD,NA,NA,NA,"University of California, San Diego",2017,2016,2023
NCT03260257,2022-03-28,2017-08-17,NA,Interventional,Not Applicable,80,Recruiting,A Neurofeedback Intervention to Improve Working Memory in Schizophrenia,2018-03-01T00:00:00Z,2023-12-30T00:00:00Z,2023-09-30T00:00:00Z,FALSE,NA,None (Open Label),OTHER,FALSE,"University of California, San Diego",NA,NA,NA,NA,"University of California, San Diego",2017,2018,2023
NCT03262519,2022-03-04,2017-07-25,NA,Observational,NA,96,"Active, not recruiting",The Effect of Obstructive Sleep Apnea and Its Treatment on Decision Making,2017-07-20T00:00:00Z,2022-12-01T00:00:00Z,2019-05-01T00:00:00Z,FALSE,NA,NA,OTHER,FALSE,"University of California, San Diego",NA,NA,NA,NA,"University of California, San Diego",2017,2017,2022
NCT03263390,2020-12-12,2017-08-24,NA,Observational,NA,6,Terminated,Modeling the Neurological Basis and Characterizing the Neurological Phenotype of Obesity Using Human Neural Stem Cells,2017-10-05T00:00:00Z,2020-08-10T00:00:00Z,2020-08-10T00:00:00Z,FALSE,NA,NA,OTHER,FALSE,"University of California, San Diego",UCSD,NA,NA,NA,"University of California, San Diego",2017,2017,2020
NCT03278301,2020-10-15,2017-09-06,NA,Observational,NA,952,Completed,PRECISION GRX Registry,2017-08-27T00:00:00Z,2020-02-06T00:00:00Z,2020-02-06T00:00:00Z,FALSE,NA,NA,INDUSTRY,TRUE,NA,"University of California, San Diego",NA,NA,NA,NA,2017,2017,2020
NCT03287271,2020-01-23,2017-08-27,NA,Interventional,Phase 1/Phase 2,90,Recruiting,ROCKIF Trial: Re-sensitization of Carboplatin-resistant Ovarian Cancer With Kinase Inhibition of FAK,2018-02-06T00:00:00Z,2024-10-01T00:00:00Z,2023-09-01T00:00:00Z,FALSE,NA,None (Open Label),OTHER,FALSE,NA,"University of California, San Diego",NA,NA,NA,"University of California, San Diego",2017,2018,2024
NCT03301064,2021-09-30,2017-09-28,NA,Interventional,Not Applicable,237,Completed,Brief Intervention by Community Health Workers for Unhealthy Drinking in Latinos,2018-06-18T00:00:00Z,2021-03-15T00:00:00Z,2021-03-15T00:00:00Z,FALSE,Randomized,None (Open Label),OTHER,TRUE,NA,"University of California, San Diego",NA,NA,NA,NA,2017,2018,2021
NCT03302377,2019-11-20,2017-09-29,NA,Interventional,Not Applicable,19,Completed,Fit for Two: Incorporating Wearable Trackers Into Clinical Care for Pregnant Women With Diabetes (FFT),2017-10-03T00:00:00Z,2019-10-31T00:00:00Z,2019-10-31T00:00:00Z,FALSE,NA,None (Open Label),OTHER,FALSE,"University of California, San Diego",NA,NA,NA,NA,"University of California, San Diego",2017,2017,2019
NCT03304652,2019-03-12,2017-10-03,NA,Observational,NA,11,Completed,Cerebral MRI During Sleep,2017-10-01T00:00:00Z,2018-10-31T00:00:00Z,2018-10-31T00:00:00Z,FALSE,NA,NA,OTHER,FALSE,"University of California, San Diego",NA,NA,NA,NA,"University of California, San Diego",2017,2017,2018
NCT03310359,2021-09-27,2016-11-02,NA,Interventional,Not Applicable,34,"Active, not recruiting",Clinical Trial of Anti-oxidant Astaxanthin in Insulin-resistant Subjects,2016-07-01T00:00:00Z,2021-12-31T00:00:00Z,2021-03-31T00:00:00Z,FALSE,Randomized,Quadruple,OTHER,FALSE,"University of California, San Diego",UCSD,NA,NA,NA,"University of California, San Diego",2016,2016,2021
NCT03310398,2017-10-09,2015-10-23,NA,Observational,NA,248,Completed,Negative-Positive Valence Domains in Anxiety and Depression,2013-09-01T00:00:00Z,2017-06-30T00:00:00Z,2017-04-30T00:00:00Z,FALSE,NA,NA,OTHER,FALSE,"University of California, San Diego",NA,NA,NA,NA,"University of California, San Diego",2015,2013,2017
NCT03344276,2021-02-08,2017-11-13,NA,Interventional,Not Applicable,20,Recruiting,Assessing Neurocognition After Cerebrovascular Intervention,2021-07-15T00:00:00Z,2024-12-01T00:00:00Z,2024-02-01T00:00:00Z,FALSE,Non-Randomized,None (Open Label),OTHER,FALSE,"University of California, San Diego",NA,NA,NA,NA,"University of California, San Diego",2017,2021,2024
NCT03347565,2021-07-06,2017-11-15,NA,Observational,NA,200,Recruiting,Brain Function in Adolescent Eating Disorders and Healthy Peers,2017-07-21T00:00:00Z,2022-06-01T00:00:00Z,2022-06-01T00:00:00Z,FALSE,NA,NA,OTHER,FALSE,"University of California, San Diego",NA,NA,NA,NA,"University of California, San Diego",2017,2017,2022
NCT03352414,2021-07-19,2017-11-18,2021-04-13,Interventional,Phase 2,84,Terminated,Phase 2 RCT of Alvimopan vs. Placebo After CRS/HIPEC,2018-03-08T00:00:00Z,2020-04-28T00:00:00Z,2020-04-28T00:00:00Z,TRUE,Randomized,Triple,OTHER,FALSE,"University of California, San Diego",UCSD,NA,NA,NA,"University of California, San Diego",2017,2018,2020
NCT03354585,2022-04-05,2017-10-16,NA,Interventional,Not Applicable,120,Recruiting,Mindfulness and Chronic Low Back Pain,2020-01-02T00:00:00Z,2024-10-02T00:00:00Z,2024-10-02T00:00:00Z,FALSE,Randomized,Triple,OTHER,TRUE,"University of California, San Diego",NA,NA,NA,NA,"University of California, San Diego",2017,2020,2024
NCT03368352,2019-01-29,2017-11-20,NA,Interventional,Early Phase 1,20,Completed,"Effects of Melatonin on Sleep, Ventilatory Control and Cognition at Altitude.",2017-07-04T00:00:00Z,2018-12-20T00:00:00Z,2018-12-20T00:00:00Z,FALSE,Randomized,Quadruple,OTHER,FALSE,"University of California, San Diego",NA,NA,NA,NA,"University of California, San Diego",2017,2017,2018
NCT03371433,2017-12-11,2017-12-07,NA,Observational,NA,79885,Completed,Soft Drinks and Osteoporosis in WHI Participants,2016-07-01T00:00:00Z,2017-05-01T00:00:00Z,2017-05-01T00:00:00Z,FALSE,NA,NA,OTHER,TRUE,"University of California, San Diego",NA,NA,NA,NA,"University of California, San Diego",2017,2016,2017
NCT03383094,2021-10-07,2017-12-18,NA,Interventional,Phase 2,114,Recruiting,Chemoradiation vs Immunotherapy and Radiation for Head and Neck Cancer,2018-03-15T00:00:00Z,2024-06-01T00:00:00Z,2023-04-01T00:00:00Z,FALSE,Randomized,None (Open Label),OTHER,TRUE,NA,"University of California, San Diego",NA,NA,NA,"University of California, San Diego",2017,2018,2024
NCT03385512,2021-10-14,2017-12-20,NA,Interventional,Not Applicable,5565,"Active, not recruiting",OPEN & ASK: Improving Patient-Centered Communication in Primary Care,2018-01-23T00:00:00Z,2021-11-01T00:00:00Z,2021-07-31T00:00:00Z,FALSE,Randomized,None (Open Label),OTHER,TRUE,"University of California, San Diego","University of California, San Diego",NA,NA,NA,"University of California, San Diego",2017,2018,2021
NCT03386929,2021-08-27,2017-12-14,NA,Interventional,Phase 1/Phase 2,130,"Active, not recruiting",Survival Prolongation by Rationale Innovative Genomics,2017-11-29T00:00:00Z,2024-10-01T00:00:00Z,2023-10-01T00:00:00Z,FALSE,NA,None (Open Label),OTHER,TRUE,NA,"University of California, San Diego",NA,NA,NA,NA,2017,2017,2024
NCT03387709,2020-03-23,2017-12-18,NA,Interventional,Not Applicable,100,Completed,"UCSD Get Fit, Be Fit Study",2018-04-04T00:00:00Z,2019-10-31T00:00:00Z,2019-07-31T00:00:00Z,FALSE,Randomized,None (Open Label),OTHER,FALSE,"University of California, San Diego","University of California, San Diego",NA,NA,NA,"University of California, San Diego",2017,2018,2019
NCT03393039,2021-09-02,2017-12-28,NA,Interventional,Not Applicable,410,Recruiting,Effects of Negative Affect in Individuals With Binge Eating Episodes,2018-02-01T00:00:00Z,2023-01-31T00:00:00Z,2023-01-31T00:00:00Z,FALSE,NA,None (Open Label),OTHER,FALSE,"University of California, San Diego","University of California, San Diego",NA,NA,NA,"University of California, San Diego",2017,2018,2023
NCT03413696,2021-09-01,2018-01-22,NA,Observational,NA,150,Completed,Effects of Health Literacy and HCV Knowledge on HCV Treatment Willingness in HIV-coinfected Patients,2017-09-08T00:00:00Z,2019-12-31T00:00:00Z,2019-12-31T00:00:00Z,FALSE,NA,NA,OTHER,FALSE,"University of California, San Diego","University of California, San Diego",NA,NA,NA,"University of California, San Diego",2018,2017,2019
NCT03414138,2019-06-07,2018-01-16,NA,Interventional,Not Applicable,40,Completed,Brain Mechanisms Supporting Meditation-based Analgesia,2018-04-20T00:00:00Z,2018-08-02T00:00:00Z,2018-08-02T00:00:00Z,FALSE,Randomized,Triple,OTHER,FALSE,"University of California, San Diego",NA,NA,NA,NA,"University of California, San Diego",2018,2018,2018
NCT03419858,2019-06-07,2018-01-16,NA,Interventional,Early Phase 1,60,Completed,The Role of Opioidergic Systems in Breathing Based Analgesia,2017-03-13T00:00:00Z,2017-06-27T00:00:00Z,2017-06-27T00:00:00Z,FALSE,Randomized,Triple,OTHER,FALSE,"University of California, San Diego",NA,NA,NA,NA,"University of California, San Diego",2018,2017,2017
NCT03422393,2021-05-06,2018-01-30,NA,Interventional,Phase 1,24,"Active, not recruiting",Venetoclax With High-dose Ibrutinib for CLL Progressing on Single Agent Ibrutinib,2018-05-01T00:00:00Z,2028-08-01T00:00:00Z,2022-08-01T00:00:00Z,FALSE,NA,None (Open Label),OTHER,FALSE,NA,"University of California, San Diego",NA,NA,NA,"University of California, San Diego",2018,2018,2028
NCT03438708,2018-09-19,2018-01-19,NA,Interventional,Phase 2,50,Unknown status,Prior Axitinib as a Determinant of Outcome of Renal Surgery,2018-03-05T00:00:00Z,2020-02-01T00:00:00Z,2019-10-29T00:00:00Z,FALSE,NA,None (Open Label),OTHER,FALSE,"University of California, San Diego",NA,NA,NA,NA,"University of California, San Diego",2018,2018,2020
NCT03440554,2021-04-22,2018-02-14,NA,Interventional,Not Applicable,150,Recruiting,Non-contrast MR Imaging for Whole Body Cancer Detection and Characterization,2016-03-24T00:00:00Z,2023-01-01T00:00:00Z,2022-03-01T00:00:00Z,FALSE,NA,None (Open Label),OTHER,FALSE,"University of California, San Diego",NA,NA,NA,NA,"University of California, San Diego",2018,2016,2023
NCT03442036,2021-01-31,2018-02-15,2020-01-12,Interventional,Not Applicable,70,Completed,Comparing Through-the-Needle With Suture-Method Catheter Designs for Popliteal Nerve Blocks,2018-04-06T00:00:00Z,2019-04-05T00:00:00Z,2019-04-01T00:00:00Z,TRUE,Randomized,Double,OTHER,FALSE,"University of California, San Diego",NA,NA,NA,NA,"University of California, San Diego",2018,2018,2019
NCT03442374,2021-04-05,2018-02-09,NA,Interventional,Not Applicable,40,Recruiting,Lumbar Spine Muscle Degeneration Inhibits Rehabilitation-Induced Muscle Recovery,2019-07-01T00:00:00Z,2022-06-01T00:00:00Z,2022-06-01T00:00:00Z,FALSE,Non-Randomized,Single,OTHER,FALSE,"University of California, San Diego",NA,NA,NA,NA,"University of California, San Diego",2018,2019,2022
NCT03443908,2021-12-02,2018-02-01,NA,Observational,NA,0,Withdrawn,Early Diagnosis and Treatment of Sleep Disordered Breathing in Lung Cancer,2017-11-17T00:00:00Z,2019-05-13T00:00:00Z,2019-05-13T00:00:00Z,FALSE,NA,NA,OTHER,FALSE,NA,NA,NA,NA,NA,"University of California, San Diego",2018,2017,2019
NCT03446729,2018-02-20,2018-02-08,NA,Interventional,Not Applicable,50,Completed,"Enhancing Memory to Facilitate Weight Loss: Tracking, Recording and Coaching",2014-01-02T00:00:00Z,2015-12-03T00:00:00Z,2015-12-03T00:00:00Z,FALSE,Randomized,Single,OTHER,TRUE,"University of California, San Diego","University of California, San Diego",NA,NA,NA,"University of California, San Diego",2018,2014,2015
NCT03446768,2021-10-28,2018-01-15,2021-09-30,Interventional,Not Applicable,294,Completed,Monitoring and Peer Support to Improve Treatment Adherence and Outcomes,2018-02-01T00:00:00Z,2019-10-31T00:00:00Z,2019-10-31T00:00:00Z,TRUE,Randomized,Single,OTHER,FALSE,NA,"University of California, San Diego",NA,NA,NA,NA,2018,2018,2019
NCT03449667,2021-09-25,2018-02-22,NA,Interventional,Not Applicable,144,"Active, not recruiting",Cryoanalgesia to Treat Post-Amputation Phantom Limb Pain: A Department of Defense Funded Multicenter Study,2018-03-23T00:00:00Z,2022-03-17T00:00:00Z,2021-08-17T00:00:00Z,FALSE,Randomized,Triple,OTHER,TRUE,"University of California, San Diego",NA,NA,NA,NA,"University of California, San Diego",2018,2018,2022
NCT03460964,2020-07-07,2018-02-23,NA,Interventional,Not Applicable,2,Terminated,Measuring Sweat Glucose of Patients With Diabetes - The ENGAGE Study,2018-05-01T00:00:00Z,2019-09-05T00:00:00Z,2019-09-05T00:00:00Z,FALSE,NA,None (Open Label),OTHER,TRUE,"University of California, San Diego",UCSD,NA,NA,NA,"University of California, San Diego",2018,2018,2019
NCT03461120,2021-10-11,2018-03-04,NA,Interventional,Phase 4,203,Enrolling by invitation,Improving Postamputation Functioning by Decreasing Phantom Pain With Perioperative Continuous Peripheral Nerve Blocks: A Department of Defense Funded Multicenter Study,2018-03-23T00:00:00Z,2023-12-01T00:00:00Z,2022-12-01T00:00:00Z,FALSE,Randomized,Quadruple,OTHER,TRUE,"University of California, San Diego",NA,NA,NA,NA,"University of California, San Diego",2018,2018,2023
NCT03462758,2021-10-04,2018-01-24,NA,Interventional,Not Applicable,404,"Active, not recruiting",Early vs. Interval Postpartum IUD Insertion,2018-03-20T00:00:00Z,2021-12-31T00:00:00Z,2021-12-01T00:00:00Z,FALSE,Randomized,None (Open Label),OTHER,TRUE,"University of California, San Diego","University of California, San Diego",NA,NA,NA,"University of California, San Diego",2018,2018,2021
NCT03473145,2021-08-10,2018-03-14,NA,Interventional,Not Applicable,405,Recruiting,Sedentary Behavior Interrupted Randomized Controlled Trial (P2),2018-05-30T00:00:00Z,2022-05-31T00:00:00Z,2022-05-31T00:00:00Z,FALSE,Randomized,Single,OTHER,FALSE,"University of California, San Diego",NA,NA,NA,NA,"University of California, San Diego",2018,2018,2022
NCT03481725,2021-02-24,2018-03-15,2021-02-04,Interventional,Not Applicable,65,Completed,Ultrasound-Guided Percutaneous Peripheral Nerve Stimulation: A Department of Defense Funded Multicenter Pilot Study,2018-07-14T00:00:00Z,2021-01-07T00:00:00Z,2020-09-11T00:00:00Z,TRUE,Randomized,Quadruple,OTHER,TRUE,"University of California, San Diego",NA,NA,NA,NA,"University of California, San Diego",2018,2018,2021
NCT03492736,2019-01-29,2018-04-02,NA,Interventional,Early Phase 1,1,Terminated,Effects of Melatonin in Untreated Obstructive Sleep Apnea,2018-04-01T00:00:00Z,2018-10-01T00:00:00Z,2018-10-01T00:00:00Z,FALSE,Randomized,Triple,OTHER,FALSE,NA,NA,NA,UCSD Pulmonary and Sleep Medicine,NA,"University of California, San Diego",2018,2018,2018
NCT03494764,2021-02-04,2018-04-04,NA,Interventional,Phase 2,39,Completed,Hyperbaric Oxygen Therapy for Ulcerative Colitis Flares,2017-09-07T00:00:00Z,2020-03-31T00:00:00Z,2020-03-31T00:00:00Z,FALSE,Randomized,None (Open Label),OTHER,TRUE,NA,"University of California, San Diego",NA,NA,NA,NA,2018,2017,2020
NCT03498378,2022-02-16,2018-03-27,NA,Interventional,Phase 1,24,"Active, not recruiting","Avelumab, Cetuximab, and Palbociclib in Recurrent or Metastatic Head and Neck Squamous Cell Carcinoma",2018-06-06T00:00:00Z,2023-07-01T00:00:00Z,2020-02-04T00:00:00Z,FALSE,NA,None (Open Label),OTHER,FALSE,NA,"University of California, San Diego",NA,NA,NA,"University of California, San Diego",2018,2018,2023
NCT03504085,2020-06-09,2018-03-02,NA,Interventional,Not Applicable,49,Completed,Overcoming Pain Through Yoga in the Military,2018-05-01T00:00:00Z,2020-05-31T00:00:00Z,2020-05-31T00:00:00Z,FALSE,Randomized,None (Open Label),OTHER,TRUE,"University of California, San Diego","University of California, San Diego",NA,NA,NA,"University of California, San Diego",2018,2018,2020
NCT03506945,2021-08-17,2018-04-06,NA,Interventional,Not Applicable,200,Recruiting,Mobile Web-based Behavioral Intervention for Improving Caregiver Well-being,2018-11-01T00:00:00Z,2023-07-31T00:00:00Z,2023-07-28T00:00:00Z,FALSE,Randomized,Single,OTHER,FALSE,"University of California, San Diego",NA,NA,NA,NA,"University of California, San Diego",2018,2018,2023
NCT03511352,2022-01-28,2018-03-26,NA,Interventional,Not Applicable,78,Recruiting,Sedentary Behavior Interrupted: A Trial of Acute Effects on Biomarkers of Healthy Aging,2018-05-08T00:00:00Z,2023-05-31T00:00:00Z,2023-05-31T00:00:00Z,FALSE,Randomized,None (Open Label),OTHER,FALSE,"University of California, San Diego",NA,NA,NA,NA,"University of California, San Diego",2018,2018,2023
NCT03514914,2020-11-16,2018-04-10,NA,Interventional,Not Applicable,2402,"Active, not recruiting",Enhancing Male Participation in Interventions to Prevent Unintended Pregnancy,2018-06-07T00:00:00Z,2022-05-31T00:00:00Z,2021-12-31T00:00:00Z,FALSE,Randomized,None (Open Label),OTHER,FALSE,"University of California, San Diego","University of California, San Diego",NA,NA,NA,"University of California, San Diego",2018,2018,2022
NCT03522805,2020-08-24,2018-05-01,NA,Interventional,Not Applicable,6,Terminated,Impact of Non-invasive Ventilation in Hypercapnic COPD,2018-04-23T00:00:00Z,2018-11-21T00:00:00Z,2018-11-21T00:00:00Z,FALSE,NA,None (Open Label),OTHER,FALSE,"University of California, San Diego",UCSD,NA,NA,NA,"University of California, San Diego",2018,2018,2018
NCT03533023,2021-08-03,2018-04-19,NA,Interventional,Not Applicable,153,Completed,The Healthy Heroes Study,2018-05-08T00:00:00Z,2021-03-04T00:00:00Z,2021-03-04T00:00:00Z,FALSE,Randomized,Single,OTHER,FALSE,"University of California, San Diego",UCSD,NA,NA,NA,"University of California, San Diego",2018,2018,2021
NCT03533621,2018-05-10,2018-04-18,NA,Interventional,Not Applicable,45,Completed,"Gut Microbiome, Adiposity, and Probiotics (GMAP)",2014-09-04T00:00:00Z,2016-12-31T00:00:00Z,2016-12-31T00:00:00Z,FALSE,Randomized,Triple,OTHER,TRUE,"University of California, San Diego",NA,NA,NA,NA,"University of California, San Diego",2018,2014,2016
NCT03534401,2020-01-07,2018-05-07,NA,Interventional,Not Applicable,659,Unknown status,Addressing Reproductive Coercion in HEalth Settings - Kenya,2018-06-01T00:00:00Z,2020-07-31T00:00:00Z,2019-08-01T00:00:00Z,FALSE,Randomized,None (Open Label),OTHER,FALSE,"University of California, San Diego",UCSD Center on Gender Equity and Health,NA,NA,NA,"University of California, San Diego",2018,2018,2020
NCT03544879,2019-10-17,2018-05-18,2019-08-16,Interventional,Not Applicable,46,Completed,Yoga to Prevent Mobility Limitations in Older Adults,2014-01-06T00:00:00Z,2014-06-30T00:00:00Z,2014-05-02T00:00:00Z,TRUE,Randomized,Double,OTHER,TRUE,"University of California, San Diego",NA,NA,NA,NA,"University of California, San Diego",2018,2014,2014
NCT03546751,2018-06-01,2018-05-21,NA,Interventional,Not Applicable,100,Not yet recruiting,Extracellular microRNA: Biomarkers of Endothelial Dysfunction in Obese Adolescents & Adults With Obstructive Sleep Apnea,2019-04-01T00:00:00Z,2024-12-31T00:00:00Z,2024-07-30T00:00:00Z,FALSE,Randomized,Single,OTHER,TRUE,"University of California, San Diego",NA,NA,NA,NA,"University of California, San Diego",2018,2019,2024
NCT03549234,2020-07-08,2018-04-24,2020-05-05,Interventional,Phase 4,100,Completed,Erector Spinae Versus Paravertebral Nerve Blocks for Breast Surgery,2018-07-12T00:00:00Z,2019-05-08T00:00:00Z,2019-05-08T00:00:00Z,TRUE,Randomized,Single,OTHER,FALSE,"University of California, San Diego",NA,NA,NA,NA,"University of California, San Diego",2018,2018,2019
NCT03551002,2021-09-01,2018-05-23,NA,Observational,NA,450,Recruiting,Impact of DAA Uptake in Controlling HCV Epidemic and Modeling Interventions for HCV Elimination Among HIV-infected Persons in San Diego,2018-01-01T00:00:00Z,2021-12-31T00:00:00Z,2021-12-31T00:00:00Z,FALSE,NA,NA,OTHER,FALSE,"University of California, San Diego","University of California, San Diego",NA,NA,NA,"University of California, San Diego",2018,2018,2021
NCT03553654,2021-09-27,2018-01-24,NA,Interventional,Not Applicable,50,"Active, not recruiting",Low-dose CT-based Method for Detection of Subclinical Anthracycline-induced Cardiotoxicity,2018-01-09T00:00:00Z,2022-06-09T00:00:00Z,2022-01-09T00:00:00Z,FALSE,NA,None (Open Label),OTHER,FALSE,"University of California, San Diego",UCSD,NA,NA,NA,"University of California, San Diego",2018,2018,2022
NCT03556384,2021-08-17,2018-06-01,NA,Interventional,Phase 2,23,Recruiting,Temozolomide (TMZ) In Advanced Succinate Dehydrogenase (SDH)-Mutant/Deficient Gastrointestinal Stromal Tumor (GIST),2018-09-12T00:00:00Z,2024-09-01T00:00:00Z,2022-09-01T00:00:00Z,FALSE,NA,None (Open Label),OTHER,TRUE,NA,"University of California, San Diego",NA,NA,NA,"University of California, San Diego",2018,2018,2024
NCT03568058,2022-02-02,2018-06-13,NA,Interventional,Phase 1,30,"Active, not recruiting",Personalized Immunotherapy in Adults With Advanced Cancers Immunotherapy in Adults With Advanced Cancers,2018-07-26T00:00:00Z,2023-08-01T00:00:00Z,2022-08-01T00:00:00Z,FALSE,Randomized,None (Open Label),OTHER,FALSE,NA,"University of California, San Diego",NA,NA,NA,"University of California, San Diego",2018,2018,2023
NCT03571386,2021-11-04,2018-06-18,NA,Observational,NA,90,"Active, not recruiting",Mechanisms of Mindfulness-based Interventions,2019-01-08T00:00:00Z,2022-09-30T00:00:00Z,2021-07-02T00:00:00Z,FALSE,NA,NA,OTHER,FALSE,NA,"University of California, San Diego",NA,NA,NA,NA,2018,2019,2022
NCT03575143,2022-02-01,2018-06-20,NA,Observational,NA,120,Recruiting,Obstructive Sleep Apnea Endotypes and Impact on Phenotypes of People Living With HIV,2018-08-02T00:00:00Z,2022-07-15T00:00:00Z,2022-07-15T00:00:00Z,FALSE,NA,NA,OTHER,FALSE,"University of California, San Diego",UCSD Pulmonary and Sleep Medicine,NA,NA,NA,"University of California, San Diego",2018,2018,2022
NCT03578237,2022-03-01,2018-06-25,NA,Interventional,Not Applicable,380,"Active, not recruiting","Cryoanalgesia to Prevent Acute and Chronic Pain Following Surgery: A Randomized, Double-Masked, Sham-Controlled Study",2018-08-25T00:00:00Z,2023-07-01T00:00:00Z,2022-08-01T00:00:00Z,FALSE,Randomized,Triple,OTHER,FALSE,"University of California, San Diego",NA,NA,NA,NA,"University of California, San Diego",2018,2018,2023
NCT03588364,2019-06-10,2018-07-04,NA,Interventional,Not Applicable,11,Completed,The Role of Osteopathic Manipulation in the the Management of Post-traumatic Migraine,2016-09-15T00:00:00Z,2019-06-01T00:00:00Z,2018-12-01T00:00:00Z,FALSE,Randomized,Triple,OTHER,FALSE,"University of California, San Diego","University of California, San Diego",NA,NA,NA,"University of California, San Diego",2018,2016,2019
NCT03588676,2019-08-13,2018-01-03,NA,Interventional,Not Applicable,39,Completed,"Effects of Melatonin on Sleep, Ventilatory Control and Cognition at Altitude",2018-01-10T00:00:00Z,2018-12-10T00:00:00Z,2018-12-10T00:00:00Z,FALSE,Randomized,Triple,OTHER,FALSE,NA,NA,NA,NA,NA,"University of California, San Diego",2018,2018,2018
NCT03590249,2021-09-28,2018-07-04,NA,Interventional,Not Applicable,28,Enrolling by invitation,Effects of a Single Osteopathic Manipulative Treatment (OMT) on Intraocular Pressure (IOP) Reduction,2018-07-01T00:00:00Z,2022-12-31T00:00:00Z,2021-12-31T00:00:00Z,FALSE,Randomized,Triple,OTHER,FALSE,"University of California, San Diego","University of California, San Diego",NA,NA,NA,"University of California, San Diego",2018,2018,2022
NCT03590652,2022-03-07,2018-06-21,NA,Interventional,Phase 2,46,Recruiting,"Daratumumab, Ixazomib, Pomalidomide, and Dexamethasone as Salvage Therapy in Relapsed/Refractory Multiple Myeloma",2018-10-17T00:00:00Z,2022-10-01T00:00:00Z,2022-10-01T00:00:00Z,FALSE,NA,None (Open Label),OTHER,FALSE,"University of California, San Diego","University of California, San Diego",NA,NA,NA,"University of California, San Diego",2018,2018,2022
NCT03611595,2021-10-06,2018-07-26,NA,Interventional,Phase 1,18,Recruiting,Cabozantinib in Combination With 13-cis-Retinoic Acid in Children With Relapsed or Refractory Solid Tumors,2018-08-28T00:00:00Z,2022-12-01T00:00:00Z,2022-08-01T00:00:00Z,FALSE,NA,None (Open Label),OTHER,FALSE,NA,"University of California, San Diego",NA,NA,NA,"University of California, San Diego",2018,2018,2022
NCT03611647,2019-04-09,2018-06-30,NA,Interventional,Not Applicable,48,Completed,Correlating Probiotic Dietary Supplements During Pregnancy With Maternal Microbiome Profiles,2018-04-01T00:00:00Z,2018-12-31T00:00:00Z,2018-12-31T00:00:00Z,FALSE,Randomized,Quadruple,OTHER,TRUE,"University of California, San Diego",NA,NA,NA,NA,"University of California, San Diego",2018,2018,2018
